reasoning,fix_locality,agent_looping,fix_complexity,problem_clarity,fix_in_description,reproduction_steps,agent_gave_up_early,agent_wrong_file_focus,error_message_provided,domain_knowledge_required,agent_expressed_uncertainty,agent_declared_success_wrongly,task_id,run_id,resolved,name,score,explanation
,,,,,,,,,,,,,sympy__sympy-24661,40552479-670f-4b59-a5ee-feaf6a7f60e3,False,task_difficulty_prediction,0.65,"Task difficulty features: fix_in_description=1 (vague hint about evaluateFalse transformer), problem_clarity=4 (clear with reproduction), error_message_provided=0, reproduction_steps=1, fix_locality=2 (requires understanding AST transformation system), domain_knowledge_required=4 (requires deep knowledge of SymPy parser architecture and AST transformations), fix_complexity=3 (moderate - need to ensure relational operators pass evaluate parameter through EvaluateFalseTransformer). Trajectory signals: agent_declared_success_wrongly=0, agent_looping=1 (catastrophically stuck trying to rebuild corrupted file), agent_expressed_uncertainty=0, agent_wrong_file_focus=0 (initially correct but then destroyed the right file), agent_gave_up_early=0. The agent made a catastrophic error by accidentally overwriting the critical parser file, then failed to recover. The actual fix requires understanding how the EvaluateFalseTransformer class handles comparison operators and ensuring they get the evaluate=False parameter, which is non-trivial but not extremely difficult for someone familiar with the codebase."
,,,,,,,,,,,,,pydata__xarray-7393,f448a6ef-a8c5-42a3-9a05-4129f23ec95f,False,task_difficulty,0.65,"This task has moderate-to-high difficulty. The problem is clearly specified with reproduction steps (problem_clarity: 5, reproduction_steps: 1), but the fix requires deep understanding of xarray's stacking implementation across multiple files. The agent thoroughly explored the codebase (dataset.py, variable.py, duck_array_ops.py) but was misled by being unable to reproduce the issue in the dev environment, leading them to conclude it was already fixed rather than implementing an actual fix. The task requires framework-specific knowledge (domain_knowledge_required: 4) and the fix involves understanding how MultiIndex creation affects dtypes. The agent's inability to reproduce the bug and subsequent documentation-only response (rather than a code fix) suggests the task has subtle requirements that aren't immediately obvious from testing alone. Key difficulty factors: fix_in_description: 0, problem_clarity: 5, error_message_provided: 0, reproduction_steps: 1, fix_locality: 2, domain_knowledge_required: 4, fix_complexity: 3, agent_declared_success_wrongly: 0, agent_looping: 0, agent_expressed_uncertainty: 0, agent_wrong_file_focus: 0, agent_gave_up_early: 1."
,,,,,,,,,,,,,sphinx-doc__sphinx-8459,44f279b1-cdc4-41f9-be67-687321178592,False,task_difficulty,0.58,"This task requires moderate Sphinx autodoc domain knowledge (score 4/5) to understand how type hints and type aliases interact. The problem is very clear (5/5) with complete reproduction steps, making understanding the issue straightforward. However, the fix requires knowing where in the autodoc pipeline to apply type aliases when typehints mode is 'description', which is non-trivial. The fix itself is localized (1/3) but the agent struggled with test setup, configuration issues, and ultimately ran out of budget. The agent did identify the correct fix location and implemented a reasonable solution, but couldn't validate it. The combination of good clarity but requiring specialized domain knowledge and careful implementation makes this a moderate difficulty task."
,,,,,,,,,,,,,django__django-13121,1464c3f8-ede4-4e50-98cb-6fe2cc722af9,False,task_difficulty,0.65,"This is a moderately difficult SWE-bench task. Task-intrinsic factors: The problem statement is clear with a specific error traceback (problem_clarity: 4), includes reproduction code (reproduction_steps: 1), and the fix is localized to 2 files with moderate complexity (fix_locality: 2, fix_complexity: 3). The fix requires Django/SQLite backend knowledge to understand how custom database functions work (domain_knowledge: 4). The issue description doesn't directly suggest the fix (fix_in_description: 1). Trajectory-based signals: The agent spent 70% of time fighting syntax errors from malformed edits rather than solving the core problem (agent_looping: 1), never verified the fix worked, and hit cost limits before completion (agent_gave_up_early: 1). The agent did locate the correct files and understand the problem conceptually (agent_wrong_file_focus: 0), suggesting the difficulty comes from execution complexity rather than problem understanding. The combination of backend-specific knowledge requirements and subtle type handling makes this a medium-difficulty task."
"This task has exceptional clarity with detailed reproduction steps, full traceback, and explicit fix direction (convert domain to punycode). However, it requires specialized knowledge of IDNA/Punycode encoding for internationalized domain names. The agent solved it efficiently in a single attempt, going directly to the correct file and applying the exact fix, demonstrating that despite the domain knowledge requirement, the clear problem specification made this task straightforward.",1.0,0.0,1.0,5.0,2.0,1.0,0.0,0.0,1.0,4.0,0.0,0.0,django__django-11532,901cb603-801a-46da-931e-c2fa9f55a2ea,False,,,
,,,,,,,,,,,,,psf__requests-2931,7920d4f6-1c61-4dd2-a6ea-a3ceb0af9ae7,False,task_difficulty,0.15,"This is a very easy task. It provides clear reproduction steps, a helpful error traceback pointing directly to the problematic function, and requires only a trivial one-parameter change from 'ascii' to 'utf-8'. The agent solved it efficiently without any confusion or wrong turns. The only complexity is understanding Python encoding, which is basic for most developers."
